{
  "$schema": "../../../../schemas/materia.schema.json",
  "schemaVersion": "0.3.0",
  "id": "es-ar.bachillerato.lenguas-propias-de-aragon-catalan",
  "territorio": "es-ar",
  "etapa": "bachillerato",
  "materia": {
    "codigo": "LPC",
    "nombre": {
      "es": "Lenguas Propias de Aragón: Catalán"
    },
    "cursos": [
      {
        "curso": 1,
        "caracter": "optativa"
      },
      {
        "curso": 2,
        "caracter": "optativa"
      }
    ]
  },
  "vigencia": {
    "entradaEnVigor": "2022-08-12",
    "aplicableDesdeCurso": "2022/2023",
    "hasta": null,
    "estado": "vigente"
  },
  "fuentes": [
    {
      "id": "boa-2022-157-orden-ecd-1173-2022",
      "tipo": "orden",
      "titulo": "Orden ECD/1173/2022, de 3 de agosto, por la que se aprueban el currículo y las características de la evaluación del Bachillerato y se autoriza su aplicación en los centros docentes de la Comunidad Autónoma de Aragón",
      "publicacion": "Boletín Oficial de Aragón",
      "numero": "157",
      "fechaPublicacion": "2022-08-12",
      "cve": "1234566820909",
      "urlOficial": "https://www.boa.aragon.es/cgi-bin/EBOA/BRSCGI?CMD=VEROBJ&MLKOB=1234566820909&type=pdf",
      "urlVerificacion": "https://www.boa.aragon.es/cgi-bin/EBOA/BRSCGI?BASE=BOLE&CMD=VERDOC&DOCN=007926626&SEC=BUSQUEDA_AVANZADA&SEPARADOR=",
      "anexo": "II",
      "paginasMateria": {
        "desde": 907,
        "hasta": 930
      }
    }
  ],
  "introduccion": {
    "es": [
      "La materia de Lenguas Propias: Catalán, como parte de las enseñanzas de Lenguas Propias de Aragón, mantiene en Bachillerato una continuidad respecto a la etapa anterior. El currículum de la materia permite consolidar la maduración lingüística del alumnado, ofreciéndole las herramientas necesarias para participar de forma activa en la sociedad, haciendo alumnos autónomos y alumnas autónomas y con capacidades para abordar el acceso a la formación superior y al futuro profesional de forma responsable y cívica, ejerciendo sus derechos democráticos como ciudadanos y como ciudadanas.",
      "El objetivo de la materia es ofrecer las herramientas necesarias para la adquisición de las competencias específicas y competencias clave de la etapa del bachillerato. Es decir, adquirir la plena consecución de la competencia plurilingüe que implica el uso de distintas lenguas de forma apropiada y eficaz para el aprendizaje y la comunicación. El plurilingüismo integra no solo la dimensión comunicativa, sino también los aspectos históricos e interculturales que conducen al alumnado a conocer, valorar críticamente y respetar la diversidad lingüística y cultural y que contribuyen a que pueda ejercer una ciudadanía independiente, activa y comprometida con una sociedad democrática. En consonancia con este enfoque, la materia de Lenguas Propias de Aragón: Catalán en la etapa del Bachillerato tiene como objetivo principal la adquisición de la competencia comunicativa en la lengua catalana y las diferentes variedades dialectales aragonesas, de modo que permita al alumnado comprender, expresarse e interactuar en dicha lengua con eficacia, fluidez y corrección, así como el enriquecimiento y la expansión de su conciencia intercultural. Por otra parte, el estudio de la materia de Lenguas Propias de Aragón: Catalán debe ser una herramienta que se ponga al servicio de la convivencia democrática, la resolución dialogada de los conflictos y la construcción de vínculos personales, profesionales y sociales basados en el respeto y la igualdad de las personas. En este sentido se mantiene una clara continuidad con la etapa anterior en la que el currículum establece la consecución de las competencias de comunicarse y desarrollarse dentro de una sociedad plural, multicultural y plurilingüe. De esta manera, la materia contribuye a la progresión en el desarrollo de todas las competencias recogidas en el perfil de salida del alumnado de la educación básica.",
      "Las competencias específicas de la Lenguas Propias de Aragón: Catalán en Bachillerato marcan una progresión con respecto a las de la Educación Secundaria Obligatoria de las que se parte en esta nueva etapa. La profundización respecto a la etapa anterior estriba en una mayor conciencia teórica y metodológica para analizar la realidad, así como en la movilización de un conjunto mayor de conocimientos, articulados a través de instrumentos de análisis que ayuden a construir y a estructurar el conocimiento explícito sobre fenómenos lingüísticos y literarios abordados en la materia. Comprenden también una aproximación a la cultura propia del patrimonio y diversidad aragonesa. Las competencias específicas comprenden el desarrollo de estrategias para profundizar los conocimientos y destrezas orales, escritas, lectoras y literarias del alumnado. Se busca una profundización en el estudio de la lengua para ofrecer recursos adaptados a la sociedad actual, que les permitan desarrollar un espíritu crítico y potenciar el análisis de la información por transmisión oral o escrita. Además, las competencias específicas abordan el estudio de la producción literaria aragonesa en catalán fundamentalmente para introducirles en el conocimiento de la misma y apreciar el placer de la lectura dentro de la dimensión social.",
      "Para cada competencia específica se formulan criterios de evaluación que establecen el nivel de desempeño esperado en cada uno de los cursos. Tienen un claro enfoque competencial y atienden tanto a los procesos como a los productos. Ello reclama herramientas e instrumentos de evaluación variados con capacidad diagnóstica y de mejora. Dado el enfoque competencial de la materia de Lenguas Propias: Catalán, la gradación entre los dos cursos no se establece en una distribución diferenciada de saberes, sino en función de la mayor o menor complejidad de los textos, de las habilidades de interpretación o de las producciones requeridas, del metalenguaje necesario para la reflexión sobre los usos, o del grado de autonomía conferido al alumnado. De ahí que tanto los saberes básicos como los criterios de evaluación guarden paralelismo en los dos cursos y continuidad con las etapas precedentes.",
      "En cuanto a los saberes básicos, están organizados en cuatro bloques: “Comunicación”, donde se integran los saberes relacionados con la comunicación oral y escrita, la producción y el análisis de textos y los procesos de investigación que han de acompañar a ambos desempeños; “Plurilingüismo e interculturalidad”, para abordar la riqueza lingüística y dialectal de Aragón; “Educación literaria” donde se recogen los saberes necesarios para consolidar el hábito lector y",
      "la lectura de obras escritas en catalán por los autores aragoneses más destacados. Por último, “Reflexión sobre la lengua” que propone abordar el aprendizaje sistemático de la gramática y la ortografía.",
      "El enfoque, nivelación y definición de los elementos del currículo están planteados a partir de actividades diversas que guíen un proceso de aprendizaje dinámico y continuado, flexible y abierto. Se trata de favorecer que el alumnado ponga en funcionamiento todos los saberes básicos en los diferentes ámbitos profesional, social, personal y educativo."
    ]
  },
  "competenciasEspecificas": [
    {
      "id": "ce-1",
      "codigoOficial": "1",
      "enunciado": {
        "es": "Explicar y apreciar la diversidad lingüística de nuestra comunidad y ser consciente de la pertenencia a la comunidad lingüística del catalán, mostrando interés en el uso de la lengua y valorando las variedades dialectales del catalán de Aragón como elemento enriquecedor de nuestro patrimonio cultural, identificando y rechazando estereotipos y prejuicios lingüísticos."
      },
      "descripcion": {
        "es": [
          "La diversidad lingüística es una característica fundamental de España y, así mismo, de nuestra comunidad autónoma. Dicha diversidad debe ser considerada, por parte del alumnado, como una fuente de riqueza social y cultural necesaria para nuestro desarrollo personal, siendo capaces de identificar y rechazar cualquier estereotipo y prejuicio lingüístico.",
          "De esta manera se pretende que el alumnado sea consciente de la pertenencia a la comunidad lingüística del catalán, mostrando interés por el uso de la lengua y valorando las variantes dialectales del catalán de Aragón como un elemento enriquecedor de nuestro patrimonio cultural. En nuestras aulas se utilizan lenguas y variedades dialectales diferentes a la lengua vehicular de aprendizaje, lo que tiene que ayudar al alumnado a valorar la riqueza cultural que ello supone y tomar conciencia sobre el funcionamiento de las lenguas a partir de la observación y comparación entre ellas.",
          "La lengua catalana se habla en diversos territorios geográficos, en los que cada variedad dialectal tiene su propia idiosincrasia. Ninguna de estas variedades geográficas ha de ser considerada más correcta que otra. Es preciso, por tanto, que el alumnado utilice con propiedad su variedad dialectal, sin dejar de tener en cuenta las convenciones establecidas en la lengua escrita, evidentemente. Todo ello con la finalidad de promover una ciudadanía sensibilizada, informada y comprometida con los derechos lingüísticos individuales y colectivos.",
          "Esta competencia está vinculada con todas las competencias de la materia de Lenguas Propias Aragón: Catalán, ya que todas se trabajan de manera transversal, pero se puede destacar una especial relación con la CE.LPC.10, en la que se favorece el uso democrático del lenguaje.",
          "Así mismo, se relaciona con la CE.LPA.8 de Lenguas Propias de Aragón: Aragonés, al poner en valor la diversidad lingüística de Aragón y con las competencias de Lengua Castellana y Literatura CE.LCL.1, CE.LCL.10, en las que se hacen referencias a estos procesos.",